{"adapter":{"actions":[{"disabledReason":"reference_unit_to_rpm_conversion_not_bound","enabled":false,"expectedSignedDefinitionSha256":"4a8bc220a783e600c25b9842802678712d8f4e3a0eb0a1948f295145105551bd","id":"org.embedlabs.inovance.sv630n.action.prepare-csv","qualification":"unqualified","requiresDc":true,"signedPdoProfileIds":["csp_1704_1b04"]},{"disabledReason":"reference_unit_to_rpm_conversion_not_bound","enabled":false,"expectedSignedDefinitionSha256":"1355c4d05de03d96f8064f60706e7eb7f0fb381caa715b5dc3f607164114a90a","id":"org.embedlabs.inovance.sv630n.action.set-csv-velocity","qualification":"unqualified","requiresDc":true,"signedPdoProfileIds":["csp_1704_1b04"]},{"disabledReason":"reference_unit_to_rpm_conversion_not_bound","enabled":false,"expectedSignedDefinitionSha256":"df27cc25c14dfb4b6aa435d4ab5d853e051f2e754e3c16093925f5ccf69393d3","id":"org.embedlabs.inovance.sv630n.action.stop-csv","qualification":"unqualified","requiresDc":true,"signedPdoProfileIds":["csp_1704_1b04"]}],"contentSha256":"acf63ee7c837cf39e87fa510aeb8aadfac89b393d04b6cf28926037499a825b9","controllerAdapterTarget":{"adapterId":"inovance.sv630n_1axis_rev00010000_csp","adapterSha256":"f5b8d1d579b9804927d9749b8ca61e18f4701ab5be75626aeda7459b9a9db99e","adapterVersion":"1.5.0","esiSha256":"e6f39fd4e0f8801c83ec3ac796e138fe3ee1566cb94bb28285b93538fdb9e4a1"},"evidenceSha256":"","id":"org.embedlabs.adapter.inovance.sv630n-1axis.rev00010000","match":{"exactEsiSha256":"e6f39fd4e0f8801c83ec3ac796e138fe3ee1566cb94bb28285b93538fdb9e4a1","maximumRevision":65536,"minimumRevision":65536,"productCode":786706,"vendorId":1048576},"processDataProfiles":[{"id":"org.embedlabs.inovance.sv630n.api038-csp-1704-1b04","requiredSignals":["org.embedlabs.inovance.sv630n.actual-position","org.embedlabs.inovance.sv630n.actual-torque","org.embedlabs.inovance.sv630n.actual-velocity","org.embedlabs.inovance.sv630n.controlword","org.embedlabs.inovance.sv630n.error-code","org.embedlabs.inovance.sv630n.following-error","org.embedlabs.inovance.sv630n.max-profile-velocity","org.embedlabs.inovance.sv630n.mode-command","org.embedlabs.inovance.sv630n.mode-display","org.embedlabs.inovance.sv630n.negative-torque-limit","org.embedlabs.inovance.sv630n.positive-torque-limit","org.embedlabs.inovance.sv630n.statusword","org.embedlabs.inovance.sv630n.target-position","org.embedlabs.inovance.sv630n.target-torque","org.embedlabs.inovance.sv630n.target-velocity","org.embedlabs.inovance.sv630n.touch-probe-function","org.embedlabs.inovance.sv630n.touch-probe-position-1","org.embedlabs.inovance.sv630n.touch-probe-position-2","org.embedlabs.inovance.sv630n.touch-probe-status"],"rxPdoIndices":[5892],"signedDcProfileId":"sync0_125us","signedPdoProfileId":"csp_1704_1b04","txPdoIndices":[6916]}],"qualification":"qualified","version":"0.3.0"},"authorizationId":"embedlabs.adapter-auth.inovance-sv630n.0.3.0.api054","canonicalization":"kvell-json-ascii-sorted-compact-lf-v1","decision":"allow","format":"embed-labs.ethercat-device-adapter-authorization-v1","formatVersion":1,"policyId":"embedlabs.adapter-authorization.production.api054","policyRevision":1,"signerKeyId":"017eec68600999eea588857f765c10e740327091ccf0fd9bde86236af3ac5783"}
