{"adapter":{"actions":[{"disabledReason":null,"enabled":true,"expectedSignedDefinitionSha256":"4e6e1ac0ca79032980f5aab89d8eb7f14905123145b87987c58bdc1a908b4b21","id":"org.embedlabs.solidot.xb6.action.clear-digital-outputs","qualification":"qualified","requiresDc":false,"signedPdoProfileIds":["do16"]},{"disabledReason":null,"enabled":true,"expectedSignedDefinitionSha256":"d7eae9ade36e0d28fde08b36511966072a63a99a5ebb089f50fdfb3d799c72bd","id":"org.embedlabs.solidot.xb6.action.set-digital-outputs","qualification":"qualified","requiresDc":false,"signedPdoProfileIds":["do16"]}],"contentSha256":"1b95083165cf124054069bd9897837d09bc414e8f375bbd77a0f9ddc1bcfa84c","controllerAdapterTarget":{"adapterId":"solidot.xb6_ec0002_rev1_do16","adapterSha256":"1b33847b728585760471384cc6dec4273c7c1fb739e001a0b848229b935e3c42","adapterVersion":"1.3.0","esiSha256":"5b0bfbfffdfde1fd293589deb4a1c59f974aa79dcd9206ac0a695ab00f395bf7"},"evidenceSha256":"","id":"org.embedlabs.adapter.solidot.xb6-ec0002.rev1","match":{"exactEsiSha256":"5b0bfbfffdfde1fd293589deb4a1c59f974aa79dcd9206ac0a695ab00f395bf7","maximumRevision":1,"minimumRevision":1,"productCode":182,"vendorId":8930371},"processDataProfiles":[{"id":"org.embedlabs.solidot.xb6.api038-do16","requiredSignals":["org.embedlabs.solidot.xb6.coupler.control","org.embedlabs.solidot.xb6.coupler.state","org.embedlabs.solidot.xb6.slot.1.digital-output.channel.0","org.embedlabs.solidot.xb6.slot.1.digital-output.channel.1","org.embedlabs.solidot.xb6.slot.1.digital-output.channel.10","org.embedlabs.solidot.xb6.slot.1.digital-output.channel.11","org.embedlabs.solidot.xb6.slot.1.digital-output.channel.12","org.embedlabs.solidot.xb6.slot.1.digital-output.channel.13","org.embedlabs.solidot.xb6.slot.1.digital-output.channel.14","org.embedlabs.solidot.xb6.slot.1.digital-output.channel.15","org.embedlabs.solidot.xb6.slot.1.digital-output.channel.2","org.embedlabs.solidot.xb6.slot.1.digital-output.channel.3","org.embedlabs.solidot.xb6.slot.1.digital-output.channel.4","org.embedlabs.solidot.xb6.slot.1.digital-output.channel.5","org.embedlabs.solidot.xb6.slot.1.digital-output.channel.6","org.embedlabs.solidot.xb6.slot.1.digital-output.channel.7","org.embedlabs.solidot.xb6.slot.1.digital-output.channel.8","org.embedlabs.solidot.xb6.slot.1.digital-output.channel.9"],"rxPdoIndices":[5632,5887],"signedDcProfileId":null,"signedPdoProfileId":"do16","txPdoIndices":[6911]}],"qualification":"qualified","version":"0.3.1"},"authorizationId":"embedlabs.adapter-auth.solidot-xb6.0.3.1.api054","canonicalization":"kvell-json-ascii-sorted-compact-lf-v1","decision":"allow","format":"embed-labs.ethercat-device-adapter-authorization-v1","formatVersion":1,"policyId":"embedlabs.adapter-authorization.production.api054","policyRevision":1,"signerKeyId":"017eec68600999eea588857f765c10e740327091ccf0fd9bde86236af3ac5783"}
